<?xml version="1.0" encoding="UTF-8"?>
<!DOCTYPE dataset SYSTEM "data.dtd">
<!--  Auto-generated by the Maven Impex Plugin -->
<dataset>
    <KRNS_DOC_HDR_T DOC_HDR_ID="2123" FDOC_DESC="rewer"
        OBJ_ID="A1CE1FBC-4CB8-672E-0CA0-8CF1F9E7001B" ORG_DOC_HDR_ID="1" VER_NBR="4"/>
    <KRNS_DOC_HDR_T DOC_HDR_ID="2381" FDOC_DESC="test"
        OBJ_ID="5376DA5C-E693-65A5-E1B4-B403660B5315" VER_NBR="2"/>
    <KRNS_DOC_HDR_T DOC_HDR_ID="2382" FDOC_DESC="test"
        OBJ_ID="1586F905-5C0A-5348-72A4-BF9ECDD1967F" VER_NBR="2"/>
    <KRNS_DOC_HDR_T DOC_HDR_ID="2383" FDOC_DESC="a5"
        OBJ_ID="00375DE1-4F36-8000-DA86-B731D73FFE03" VER_NBR="2"/>
    <KRNS_DOC_HDR_T DOC_HDR_ID="2384" FDOC_DESC="asdf"
        OBJ_ID="BD50B601-2F27-184A-6349-52F696F1927B" VER_NBR="5"/>
    <KRNS_DOC_HDR_T DOC_HDR_ID="2387" FDOC_DESC="test trans doc"
        OBJ_ID="5FECE942-58D1-CCA7-36D9-F47AD78EEE89" VER_NBR="2"/>
    <KRNS_DOC_HDR_T DOC_HDR_ID="2388" FDOC_DESC="test trans doc 2"
        OBJ_ID="30034849-5137-0893-9871-87B1D8015D77" VER_NBR="2"/>
    <KRNS_DOC_HDR_T DOC_HDR_ID="2389" FDOC_DESC="test trans doc 3"
        OBJ_ID="889E14B3-B2C4-1B46-6B95-FDA71509360B" VER_NBR="2"/>
    <KRNS_DOC_HDR_T DOC_HDR_ID="2390" FDOC_DESC="test trans doc 4"
        OBJ_ID="D97C2F77-0CAE-0CF4-BBC8-F7D83143A72D" VER_NBR="2"/>
    <KRNS_DOC_HDR_T DOC_HDR_ID="2391" FDOC_DESC="test trans doc 5"
        OBJ_ID="FA4C747D-D12F-FBE5-4841-5FE813973D3F" VER_NBR="3"/>
    <KRNS_DOC_HDR_T DOC_HDR_ID="2392" FDOC_DESC="a8"
        OBJ_ID="37681271-55AD-67D3-994D-9438CC088A2C" VER_NBR="5"/>
    <KRNS_DOC_HDR_T DOC_HDR_ID="2393" FDOC_DESC="asdf"
        OBJ_ID="494D43EF-7987-2726-4F0D-2C3817A28A87" VER_NBR="2"/>
    <KRNS_DOC_HDR_T DOC_HDR_ID="2394" FDOC_DESC="asdf"
        OBJ_ID="D0E4F8A1-617C-6819-3DBE-5189C9248E43" VER_NBR="5"/>
    <KRNS_DOC_HDR_T DOC_HDR_ID="2396" FDOC_DESC="asdf"
        OBJ_ID="128456EF-B9B4-D940-FFF8-2DD5E66312D6" VER_NBR="2"/>
    <KRNS_DOC_HDR_T DOC_HDR_ID="2400" FDOC_DESC="asdf"
        OBJ_ID="FFB6EF95-9B5B-85DB-7044-5F72EAC68615" VER_NBR="2"/>
    <KRNS_DOC_HDR_T DOC_HDR_ID="2401" FDOC_DESC="dsaf"
        OBJ_ID="CA3E068D-CA02-190F-FE25-0E3DCBA14C96" VER_NBR="2"/>
    <KRNS_DOC_HDR_T DOC_HDR_ID="2402" FDOC_DESC="sdfa"
        OBJ_ID="35BC7B93-8288-5D36-D32A-1B1096094081" VER_NBR="2"/>
    <KRNS_DOC_HDR_T DOC_HDR_ID="2403" FDOC_DESC="sadf"
        OBJ_ID="80729320-661F-9133-473B-69E0138D4A9B" VER_NBR="2"/>
    <KRNS_DOC_HDR_T DOC_HDR_ID="2404" FDOC_DESC="ASDf"
        OBJ_ID="38735150-77D3-BA30-3B01-D7F025C15FAA" VER_NBR="2"/>
    <KRNS_DOC_HDR_T DOC_HDR_ID="2405" FDOC_DESC="sdaf"
        OBJ_ID="D3537A08-6173-4DD8-B925-E3493F587DCD" VER_NBR="4"/>
    <KRNS_DOC_HDR_T DOC_HDR_ID="2406" FDOC_DESC="a14"
        OBJ_ID="36A06489-8F83-C489-455F-A1D4A9082248" VER_NBR="5"/>
    <KRNS_DOC_HDR_T DOC_HDR_ID="2407" FDOC_DESC="dsaf"
        OBJ_ID="539F5EAB-CFBB-16D8-E7C0-6326793DCDB3" VER_NBR="4"/>
    <KRNS_DOC_HDR_T DOC_HDR_ID="2410" FDOC_DESC="sadf"
        OBJ_ID="0A69E828-1BE0-CC72-FB18-A518033184E7" VER_NBR="5"/>
    <KRNS_DOC_HDR_T DOC_HDR_ID="2480" FDOC_DESC="nate"
        OBJ_ID="A1DACA08-BA46-F2CC-F3E6-2F5C7FA9ACC4" VER_NBR="2"/>
    <KRNS_DOC_HDR_T DOC_HDR_ID="2481" FDOC_DESC="nate2"
        OBJ_ID="39EE9595-5121-1527-0E6E-B1380A1A13A7" VER_NBR="2"/>
    <KRNS_DOC_HDR_T DOC_HDR_ID="2482" FDOC_DESC="nate3"
        OBJ_ID="26ECE1C4-077D-2772-312D-B03B14D117FB" VER_NBR="4"/>
    <KRNS_DOC_HDR_T DOC_HDR_ID="2483" FDOC_DESC="nate after convertions"
        OBJ_ID="6948923D-524D-3990-EAF6-28247E1B1904" VER_NBR="4"/>
    <KRNS_DOC_HDR_T DOC_HDR_ID="2484" FDOC_DESC="one more"
        OBJ_ID="BAB7E16B-792C-26A6-80DB-5FAACFC45CF1" VER_NBR="4"/>
    <KRNS_DOC_HDR_T DOC_HDR_ID="2500" FDOC_DESC="testing patch"
        OBJ_ID="6B2F08FD-15C4-72F2-10C2-E887F5C6752E" VER_NBR="2"/>
    <KRNS_DOC_HDR_T DOC_HDR_ID="2501" FDOC_DESC="testing patch 2"
        OBJ_ID="ECF3E5A5-E5A3-0EB9-38E6-510D71084E9D" VER_NBR="4"/>
    <KRNS_DOC_HDR_T DOC_HDR_ID="2520" FDOC_DESC="2234"
        OBJ_ID="EE1240AF-EA07-F774-0B1C-7483C853FB3E" VER_NBR="2"/>
    <KRNS_DOC_HDR_T DOC_HDR_ID="2521" FDOC_DESC="asdfsd"
        OBJ_ID="2028AB52-184F-86E2-0BD3-8CE296CF2F84" VER_NBR="2"/>
    <KRNS_DOC_HDR_T DOC_HDR_ID="2522" FDOC_DESC="sadf"
        OBJ_ID="F0FDB682-C109-CD1F-EB32-347A7D04270D" VER_NBR="4"/>
    <KRNS_DOC_HDR_T DOC_HDR_ID="2584" FDOC_DESC="sadsadsadas"
        OBJ_ID="4A9A559F-9D10-9B92-E814-60F82E392853" VER_NBR="2"/>
    <KRNS_DOC_HDR_T DOC_HDR_ID="2640" EXPLANATION="dsf" FDOC_DESC="test"
        OBJ_ID="1F360AC6-6DCD-BFA2-63E3-B5027F41B391"
        ORG_DOC_HDR_ID="123" VER_NBR="4"/>
    <KRNS_DOC_HDR_T DOC_HDR_ID="2692" FDOC_DESC="test"
        OBJ_ID="8ED05623-5D21-C6ED-715F-CEF4E3C43D30" ORG_DOC_HDR_ID="1" VER_NBR="2"/>
    <KRNS_DOC_HDR_T DOC_HDR_ID="2693" FDOC_DESC="test"
        OBJ_ID="59108177-A298-55C3-2595-DAFD985F67F2" VER_NBR="2"/>
    <KRNS_DOC_HDR_T DOC_HDR_ID="2694" FDOC_DESC="esdf"
        OBJ_ID="58EF3839-6297-549E-FCB1-B23144800B0E" VER_NBR="2"/>
    <KRNS_DOC_HDR_T DOC_HDR_ID="2695" FDOC_DESC="dfads"
        OBJ_ID="575820F1-EE03-E7C8-F32B-9640D0D25B5A" VER_NBR="7"/>
    <KRNS_DOC_HDR_T DOC_HDR_ID="2700"
        FDOC_DESC="Create a new delegation rule for test"
        OBJ_ID="CCE4C116-CE7C-2D35-759B-E9C28D7CFAAB" VER_NBR="5"/>
    <KRNS_DOC_HDR_T DOC_HDR_ID="2701" FDOC_DESC="test"
        OBJ_ID="564A761C-6CCD-2E0B-6AC7-E528B655CA60" VER_NBR="2"/>
</dataset>
